{
  "id": "cta.pitch-timeline",
  "kind": "section",
  "semantic": {
    "id": "cta.pitch-timeline",
    "category": "cta"
  },
  "source": {
    "id": "cta",
    "tag": "section",
    "file": "src/components/Pricing.jsx",
    "lines": "9-89",
    "citation": "mv.section.pitch"
  },
  "retrievalEligible": true,
  "description": "Conversion block that restates the offer: kicker, 2-line display heading (one behind-canvas word), pill CTA to #signup and price note, then one row of two text blocks (timeline, price) and a 3-column price timeline table (hidden at 767px and below). Shares anchor id 'cta' with content.block-pairs (duplicate id on the source).",
  "variants": {
    "default": {
      "anchorId": "cta",
      "contentFields": [
        "kicker",
        "heading",
        "cta",
        "priceNote",
        "row",
        "timeline"
      ],
      "maxWords": {
        "kicker": 6,
        "heading.lines[][].text": 4,
        "cta.label": 5,
        "priceNote.line1": 6,
        "priceNote.line2": 4,
        "row.left.label": 3,
        "row.right.label": 3,
        "row.left.headingLines[]": 4,
        "row.right.headingLines[]": 4,
        "row.left.body": 45,
        "row.right.body": 45,
        "row.left.monoNote[]": 14,
        "row.right.monoNote[]": 14,
        "timeline.cornerLabel": 3,
        "timeline.columns[].title": 6,
        "timeline.columns[].date": 6,
        "timeline.rows[].price": 4
      },
      "realWordCounts": {
        "kicker": 4,
        "heading.lines[][].text": 2,
        "cta.label": 3,
        "priceNote.line1": 4,
        "priceNote.line2": 2,
        "row.left.label": 1,
        "row.right.label": 1,
        "row.left.headingLines[]": 2,
        "row.right.headingLines[]": 2,
        "row.left.body": 30,
        "row.right.body": 30,
        "row.left.monoNote[]": 9,
        "row.right.monoNote[]": 9,
        "timeline.cornerLabel": 1,
        "timeline.columns[].title": 4,
        "timeline.columns[].date": 4,
        "timeline.rows[].price": 2
      },
      "motion": {
        "allowedPatterns": [
          "scramble-text",
          "text-reveal-word",
          "alpha-fade",
          "cta-hover",
          "scale-line",
          "scale-dot"
        ],
        "reducedMotionFallback": "final-state-instant",
        "fallbackEvidence": "mv.motion.no-reduced-motion"
      }
    }
  },
  "constraints": {
    "onePerPage": true
  },
  "responsive": {
    "base": {
      "rows": "two columns (45% each), space-between, 10em vertical margins",
      "evidence": "mv.spacing.container"
    },
    "max991": {
      "rows": "stack into one column, aligned start; blocks 70% wide",
      "behindCanvasWords": "static, z-index 0",
      "evidence": "mv.responsive.flex-hb"
    },
    "max767": {
      "blocks": "90% wide, margin-bottom 3em",
      "timelineTable": "hidden (pitch-timeline variant)",
      "evidence": "mv.responsive.data-hide"
    },
    "max479": {
      "blockHeading": "14vw",
      "evidence": "mv.type.display"
    }
  },
  "uses": {
    "primitives": [
      "primitive.mono-label",
      "primitive.display-heading",
      "primitive.button-pill"
    ],
    "components": [
      "component.text-block",
      "component.price-note",
      "component.timeline-table"
    ]
  },
  "knownQuirks": [
    "Duplicate id 'cta' on this section and on content.block-pairs; the footer 'CTA' link resolves to the first (feature-pairs). anchorId is const 'cta' on both sections; graph rule DUPLICATE_ANCHOR_ONLY_DOCUMENTED warns on it and errors on any other duplicate.",
    "In the pitch-timeline table, row 2's DOM order puts the rule-line before the last column; visual result is a dot in column 3."
  ],
  "evidence": [
    "mv.section.pitch",
    "mv.structure.duplicate-cta-id"
  ],
  "budgetPolicy": "mv.copy.budget-policy"
}
